{
  "applicability": [
    "workflow contract tests"
  ],
  "client_ticket_id": "ticket-1",
  "closed_revision_proof": {
    "closed_at": "2026-09-05T09:00:00Z",
    "episode": 1,
    "ledger_revision": 1,
    "status": "closed"
  },
  "content_hash": "f540caf883a944159f07c422f10fb9a5e711224795784532b47801e285fee96c",
  "corrections": [],
  "created_at": "2026-09-05T09:00:00Z",
  "engineer_case_id": "case-1",
  "episode": 1,
  "evidence_categories": [
    "synthetic_test"
  ],
  "guardrail": {
    "reason": "safe",
    "verdict": "pass"
  },
  "investigation_id": "investigation-1",
  "ledger_revision": 1,
  "limitations": [
    "Synthetic evidence only."
  ],
  "promotion_id": "promotion-case-1-1",
  "review": {
    "reason": "reviewed",
    "verdict": "pass"
  },
  "sanitization": {
    "reason": "sanitized",
    "verdict": "pass"
  },
  "sanitized_knowledge": {
    "summary": "A sanitized synthetic conclusion."
  },
  "schema_version": "v1",
  "status": "awaiting_transport",
  "targets": [
    "tencentdb_knowledge",
    "skill_evolution"
  ]
}
